"id","survey_lang","purpose"
"s589","eng","I think that it might have been identifying how word choice and perspective can change an individual's interpretation of a scenario. "
"s590","eng","To see how people perceive what (or who) is right/wrong"
"s591","eng","I think the purpose of this study is to determine the factors that influence cognitive decision making. "
"s592","eng","Whether or not people truly know something or if they just believe they know something."
"s593","eng","To look for the effects of language on perception of various situations. "
"s594","eng","To understand how we perceive the correctness of assumptions when under unknown factors"
"s596","eng","I feel like the purpose of this study is to discover what people know about their knowledge and their beliefs."
"s597","eng","To see what people believe is true/real."
"s598","eng","It is interesting how people could react deepening of the situation. "
"s609","eng","To see how different people look at the same scenario in different ways"
"s610","eng","I think that the purpose of this study is to understand people's knowledge and thoughts on whether something is a belief or a fact. "
"s620","eng","To see the perception of the people participating in the study on whether or not another person's perception is believable or not. "
"s621","eng","To determine how humans perceive real from fake?"
"s622","eng","I think that the purpose of this study was to explore the way that we apply different words with different connations to the same situation. "
"s636","eng","I honestly have no clue. My gut tells me it has something to do with if we believe or know what the people in the readings feel one way or another, or the study has something to do with us reading the passages and then based on those passages how we answer these questions in terms of unconfident (believes) or confident (knows) to see if the ideas in our minds carry on after the study has supposedly ended."
"s660","eng","I think the purpose of this study was to see what people thought about a store they read about someone else. This helps the researchers see what people think about other people situations."
"s661","eng","I think the purpose of this study is to figure out what people think that other people are aware of."
"s663","eng","I think the purpose of this study is to study the difference between knowing something or only believing something is true and whether or not it's true because you know it is or it turns out to be true by luck."
"s664","eng","I think this study deals with the perspectives of individuals in a given situation in which the main characters may or may not have full information on the matter. The study, however, wants to see our perspective on the matter since we have all of the information. "
"s666","eng","I think it was to see if people realize that just because they think it is the correct answer, it may not necessarily the correct or right answer. "
"s668","eng","To see how responses change based on the circumstances of a situation."
"s669","eng","jjjj"
"s680","eng","To show the difference between beliefs and knowledge."
"s683","eng","I think the purpose of this study was to see how different people interpret situations."
"s686","eng","I believe the purpose of the study is to assess how people perceive situations; reality and being confident vs. not knowing the truth or being deceived. "
"s688","eng","i have no idea."
"s690","eng","To help understand the knowledge vs guessing of humans"
"s696","eng","I do not have a good idea of what the purpose is."
"s697","eng","I believe the purpose of this study is to help understand what an outsider thinks when they know the whole situation, as though it seems the people """"""""only believe"""""""" the majority of the time, I said the characters in the story """"""""knew"""""""" what they saw because in their mind, they did know, even if it was wrong."
"s700","eng","Well I thought that it was about """"""""knowing"""""""" vs. """"""""believing,"""""""" but half of the questions are now about how I felt and what I think the purpose is, so now I don't think it has anything to do with those first questions and instead, it's something tricky about how we took the study. But I don't actually know for certain what the study is about."
"s702","eng","I do not know"
"s716","eng","I think the purpose was to see how we can undestand the situation if a person is right oe wrong."
"s717","eng","judging the variables that make people believe something vs. what makes people know something "
"s718","eng","To see what participants believe is ideas based on facts or theory."
"s725","eng","To establish peoples perception of reality.  "
"s726","eng","I think that the purpose of this study was to analyze the reactions or beliefs that individuals make when faced or told of a certain situation. "
"s727","eng","I think the purpose of this study was to tell how well I was paying attention to the paragraphs and how I would react to strangely worded questions"
"s729","eng","How well people can answer questions based off of their short term memory. See how well people can deconstruct a few paragraphs. "
"s730","eng","I think that the purpose may involve how our brains try to  evaluate situations based on very little background."
"s731","eng","To see how the reader feels towards the person talked about."
"s732","eng","To question and test the boundaries of what people think they know, and what they actually know for a fact."
"s737","eng","I think the purpose of this study was to test how well I paid attention to the paragraph without knowing what the questions would be, then how well I would answer strangely worded questions"
"s739","eng","i have no idea"
"s740","eng","I am really not sure."
"s742","eng","I dont know what the purpose of this study is"
"s743","eng","I am not sure."
"s746","eng","logical reasoning"
"s757","eng","To figure out what people really think they know and how confident they are in what they think they know, even though the possibility to be wrong is always present."
"s760","eng","I believe the purpose of this study is to show people that there are many things that people believe 
are true, but in reality aren't and vice versa. This study could also have the purpose of examining people to see if they themselves are able to understand the difference between something that is believed to be true and something that is actually true."
"s761","eng","I believe the purpose of this study was to show people that you can't always trust what you believe."
"s762","eng","The purpose may have been to test the recall of the story as well as the beliefs that people have towards certain things. "
"s763","eng","Knowledge about beliefs."
"s772","eng","I believe the purpose was to determine how easily we attribute wrong answers to situational versus dispositional occurrences."
"s773","eng","the purpose was to determine how we judge {Category:} based on their awareness of their knowledge."
"s776","eng","I think the purpose of this study was to see what {Category:} think others are aware of."
"s795","eng","To see how {Category:} perceive and belief things "
"s796","eng","I think this study is focusing on the perspective of individuals in the fictional scenarios, as well as our perspective in being the all-knowing reader. Due to the fact that the reader has all of the information from the story, it is easy to see the explanations behind the choices and thinking made by each character in the different scenarios. I think the idea in understanding all sides of one's perspectives would limit the disagreements in today's world. For instance, the story with the father and son driving through the tornado town. The father thought he was pointing at a real house, but it was in fact a fake house. Since it was evident to the reader that he was unaware of the recent tornado that had ripped through the town, it is easy to understand his belief. If the reader did not know this information, it could be highly likely that they think the father is not very intelligent because he can't tell the difference between a fake and real house. The study is all about gaining every angle on someone's belief, before making judgement upon them."
"s797","eng",".."
"s815","eng","To examine the general public's response to the reasons {Category:} get certain things right or wrong."
"s818","eng","Not sure, test {Category:}'s comprehension of language maybe"
"s819","eng","to find out if {Category:} actually paid attention "
"s822","eng","To test {Category:} ability to judge others based on the information given, "
"s838","eng","n/a"
"s839","eng","n/a"
"s840","eng","To understand our opinions on other {Category:}'s knowledge, and compare them. "
"s841","eng","To study how an individual judges the actions, motivations, beliefs of others."
"s845","eng","to show how {Category:} percieve different things"
"s849","eng","I think the purpose of this study was to compare and contrast knowledge to assumptions."
"s850","eng","I have no idea"
"s862","eng","I think the study was bringing into question whether we truly know things, or if we only believe them to be true based on the evidence provided to us. "
"s863","eng","To see how {Category:} perceive different things from an outside perspective"
"s867","eng","Not sure "
"s875","eng","reading comprehension"
"s876","eng","I think the purpose of this study was to take a deeper look into what {Category:} think they know or believe about something upon first glance. "
"s877","eng","to see how {Category:} form perceptions"
"s879","eng","none"
"s883","eng","I felt the purpose was to determine how others judge others when knowledge of a situation is given to them about the others."
"s902","eng","I think the purpose of this study was to interpret our perspective on other's ability to perceive common knowledge"
"s940","eng","To study how perceptive {Category:} really are and if what they see is a reality."
"s941","eng","To see how {Category:} think about other {Category:}'s knowledge on certain things?"
"s942","eng","I think this study was to see the outside perception of situations"
"s943","eng","To see if {Category:} are able to understand the context they are reading. To also understand what characters in a story believe."
"s1000","eng","Testing how {Category:} view beliefs and what they are"
"s1016","eng","NA"
"s1017","eng","To get feedback on experimental information."
"s1018","eng","To understand the extent to which {Category:} are paying attention to the scenarios"
"s1019","eng","To determine how our perception of reality can be right or wrong and how the circumstances surrounding what we perceive affect our perception"
"s1020","eng","The questions that were asked about the individuals taking the survey instead of the responses to the scenarios. "
"s1021","eng","N/A"
"s1025","eng","No idea"
"s1026","eng","maybe to see how a questioner effect confidence "
"s1043","eng","I think the purpose of this study was to evaluate the psychological processes associated with perception by testing situational variables. "
"s1045","eng","i have no idea"
"s1047","eng","To see if there is an ability to see what is real and what is not. "
"s1050","eng","the purpose was to determine differences between knowing and believing  "
"s1052","eng","To see {Category:}'s opinions on others beliefs in difficult scenarios. "
"s1053","eng","No idea"
"s1055","eng","How {Category:} perceive reality. That's my best guess.  "
"s1056","eng","N/A"
"s1058","eng","What knowledge we have about beliefs"
"s1059","eng","to see if {Category:} pay attention to details when they read."
"s1060","eng","I think the purpose of the study was to see how much {Category:} trust their instincts."
"s1062","eng","To see if readers can remember the details of what they read."
"s1063","eng","To see what readers remember."
"s1066","eng","When we know the full situation, but another person doesn't do we think they are right or wrong in their beliefs/choices in the situation."
"s1092","eng","To see how {Category:} feel when someone doesn't have all the facts, but assumes they are correct."
"s1094","eng","To see if {Category:} are driven by ability/inability or luck."
"s1095","eng","To see how we interpret certain scenarios in our minds. "
"s1096","eng","i have no idea "
"s1100","eng","To see how quickly {Category:} adjust to patterns"
"s1109","eng","I think it had to do with {Category:} not knowing the full story and making decisions based on assumptions "
"s1111","eng","TEST"
"s1112","eng","To understand how {Category:} perceive knowing and being lucky. "
"s1113","eng","THIS IS A TEST"
"s1114","eng","Test"
"s1120","eng","To determine how {Category:} think differently of believing and knowing."
"s1122","eng","I have no idea"
"s1134","eng","To see what something thinks of others thoughts"
"s1136","eng","Not sure "
"s1137","eng","N/A"
"s1178","eng","TEST"
"s1208","eng","TEST"
"s1211","eng","TEST"
"s1213","eng","TEST"
"s1339","eng","TEST"
"s1379","eng","idk"
"s1393","eng","Measure ability vs. inability "
"s1400","eng","To determine luck versus knowledge."
"s1420","eng","To understand the way {Category:} think and process vague scenarios. "
"s1447","eng","Maybe how well {Category:} retain information."
"s1450","eng","to see how different {Category:} perceive different scenarios "
"s1451","eng","To see how well your mind remembers things "
"s1452","eng","To retrieve information about the objective mind.  Dialectical thought. Are individuals able to consider the unknown/contrast of an event. If they know is it by chance or by observation."
"s1465","eng","I think the purpose of this study is how students respond to the questions based on the scenarios and to measure how their answers vary throughout the survey. "
"s1475","eng","H pay how well {Category:} pay attetion"
"s1477","eng","Something to do with individuals' perceptions of ability, knowledge and luck."
"s1478","eng","to see if the participant can recognize given information and guage whether the scenario's right or wrong."
"s1479","eng","Perception."
"s1484","eng","I think the purpose of this study is to show that not everything you see is as it seems. "
"s1489","eng","Paying attention to the study and how the answers correlate to our feelings about the study."
"s1490","eng","i think how we interpret certain things."
"s1495","eng","paying attention "
"s1502","eng","information about language"
"s1509","eng","personal perceptions"
"s1510","eng","To study thinking and reasoning"
"s1518","eng","to see if the participant has a different view on {Category:} with different knowledge standards to see if that can affect their intuition about something that looks similar to what they are looking at or studying. "
"s1519","eng","I am not sure what this study was about. Maybe to study how effective our thinking is when it comes to analyzing something we just read. "
"s1521","eng","Opinion/ memory on certain readings "
"s1535","eng","To understand the way humans process decision making."
"s1537","eng","Maybe how self-aware one is and how much responsibility one takes for their thought processes?  I don't know lol"
"s1548","eng","To study the memories of those that are participating."
"s1663","eng","to determine perception of knowlegde and luck"
"s1695","eng","N/a"
"s1696","eng","To get information."
"s1764","eng","Trying to understand language I guess."
"s1765","eng","the ability to assess different situations."
"s1767","eng","to judge and adapt to situations quickly"
"s1790","eng","cool"
"s1791","eng","to asses simulations accurately."
"s1799","eng","To show how people react without really knowing sometimes"
"s1813","eng","TEST"
"s1816","eng","TEST"
"s1818","eng","TEST"
"s1842","eng","TEST"
"s1853","eng","No idea."
"s1855","eng","No"
"s1889","eng","To figure out the ability of readers and comprehension"
"s1929","eng","I don't know."
"s1930","eng","To determine how people perceive a character's confidence in their observations according to language."
"s1931","eng","Understanding the perception of right and wrong. "
"s1932","eng","I am not sure."
"s1933","eng","Like I said I don't know. "
"s1940","eng","NO IDEA"
"s1942","eng","to gather information but I am not sure why"
"s1954","eng","To extend the statement that every person holds its own opinion. "
"s1959","eng","To demonstrate study habits,"
"s1961","eng","To see how thinking changes based on the language of each situation "
"s1972","eng","To see how objects are what they seem to be."
"s1986","eng","TEST"
"s1996","eng","TEST"
"s2031","eng","no idea"
"s2081","eng","TEST"
"s2103","eng","We hope that our results will contribute to the scientific knowledge of how language works."
"s2127","eng","To emphasize how everyone has their own perceptions and interpretation of language and stories."
"s2128","eng","To see how different people react to different situations"
"s2165","eng","Purpose of the study was to determine if the participant read and comprehended. "
"s2166","eng","I believe the purpose of this study had a lot to do with memory. Seeing whether we could remember well or not."
"s2167","eng","To try and understand how the wording of the story may effect the way we understand the information. But that is a random guess"
"s2168","eng","understanding reason"
"s2169","eng","How we process language and how our opinions can be changed based on reading"
"s2170","eng","peoples ability to reason "
"s2173","eng","To see how the use of language affected our opinions"
"s2174","eng","no idea"
"s2176","eng","To see how people perceive things without knowing completely what they saw."
"s2178","eng","Why people think the way they do"
"s2179","eng","I think the purpose of this study was to define someone's perception of an object by either their ability/luck, and if they knew/believed the perceived object as correct/incorrect."
"s2180","eng","To analyze language "
"s2183","eng","To see if language can effect how we process direct information given/received"
"s2184","eng","I think a part of the study is about how people interpret language id different ways."
"s2185","eng","I understood somewhat of the questions after reading the short stories. However, don't understand the full purpose of this particular study. "
"s2186","eng","To see how well people retain information they just read."
"s2187","eng","To see the difference between actually knowing something and just thinking we know something. "
"s2188","eng","To understand reasoning behind what people think is under others control, whether it is luck or ability. "
"s2189","eng","I think the purpose of this study is to give people tricky analogies and see if they have what it takes to think hard about the answer."
"s2190","eng","To see how the wording and background knowledge of a question affects a persons response. "
"s2191","eng","I have read about relatively similar studies done on young children that attempted to measure theory of mind."
"s2192","eng","i think the purpose of this study is to figure out if i understand the reasoning behind why people think the way they do whether is it reasonable or unreasonable."
"s2193","eng","I think the purpose of this study is to figure out how people view scenarios in which the people are not fully aware of all the factors."
"s2194","eng","I think the purpose of this study was to see if we blamed ourselves or others for our successes and failures."
"s2195","eng","understanding people resolution"
"s2196","eng","some sort of correlation of luck and ability to know things?"
"s2217","eng","TEST"
"s2220","eng","TEST"
"s2224","eng","TEST"
"s2226","eng","TEST"
"s2229","eng","TEST"
"s2231","eng","TEST"
"s2234","eng","I don't know"
"s2242","eng","Not sue"
"s2245","eng","TEST"
"s2327","eng","To evaluate comprehension skills & remembering the information we were given"
"s2379","eng","The purpose of the study is to see how one evaluates others based on the availability of information."
"s2380","eng","I believe the purpose of this study is to gauge how people respond to data and how having excess background knowledge effects our analysis of situations "
"s2381","eng","To see people's different perspectives on scenarios. "
"s2394","eng","I am unsure what this study was trying to achieve"
"s2416","eng","The purpose of this study was to see the difference between how people view knowledge, and what they believe to be true, even though it might actually not be true. This can vary based on a person's general knowledge of the topic of just plain luck. "
"s2466","eng","to see how closely we pay attention "
"s2467","eng","To determine how participants detect language and end results. "
"s2468","eng","to see how closely people pay attention to detail"
"s2469","eng","I believe the purpose of this study is to determine the difference between what people believe to be true and what is in fact true."
"s2470","eng","i think the purpose was to see if people would essentially think the person in the story should have know what was the right answer, because we as the participants did or if they would expect the person to get it wrong."
"s2472","eng","I believe the purpose was to identify how we receive the information around us "
"s2476","eng","To observe language"
"s2479","eng","I think the purpose of this study was to show that when reading something you can easily form an opinion or idea without the story actually telling you straight up. I also believe that it was to show that people can read the same story and have different opinions about the situation. "
"s2480","eng","one's ability to see a situation in several ways "
"s2558","eng","TEST"
"s2565","eng","To see how somebody evaluates the choices of others and analyzes the thoughts of others."
"s2566","eng","I don't know"
"s2568","eng","To see how people pay attention. "
"s2605","eng","I think the purpose of this study was to see how different people perceive other's choices. "
"s2606","eng","no idea"
"s2608","eng","I believe that the purpose of this study was to discover how people think about certain situations. Language may affect how their viewpoint may come across."
"s2611","eng","to see if people could follow stories that could be misleading or confusing"
"s2612","eng","To see what people can make themselves believe and ultimately think it is fact without fully knowing what it is."
"s2614","eng","How wording affects perception of situation."
"s2615","eng","I think that the purpose of the study is to see how people interpret and view scenarios differently. "
"s2616","eng","see how we interpreted the story through how it was written"
"s2617","eng","to understand reasoning"
"s2618","eng","to observe peoples ability to judge someone with inside knowledge"
"s2619","eng","I think the purpose of this study was to test your thinking skills."
"s2620","eng","i think the purpose of this study to analyze ones mind and how they interpret senarios "
"s2621","eng","To see if the mind can comprehend reading?"
"s2623","eng","to determine perception differences "
"s2624","eng","I think it was about certain wording and how each scenario was different."
"s2626","eng","to see people might think vs whats real"
"s2627","eng","The sheet mentioned something about language, but I didn't necessarily notice research about language. It was more based on fact or assumption. I feel the study was about how many things humans think they """"""""know"""""""" when in reality, they only think they know, or they are making an unknown assumption."
"s2628","eng","To figure out the persons thinking"
"s2629","eng","I think the purpose of this study was to see if someone's opinions changed from story to story, even though they were all very similar."
"s2631","eng","I think the purpose of this study is to see how people think and how given scenarios may contribute to opinion "
"s2632","eng","I don't know the purpose of this study."
"s2633","eng","To undertsand reasoning behind an answer or thought process"
"s2635","eng","I think the purpose of this study is to decide whether an opinion is based on luck or on fact and knowledge."
"s2637","eng","To see how people view deception and knowledge."
"s2638","eng","To analyze interpretations of situations"
"s2639","eng","pay attention to detail?"
"s2642","eng","im not sure "
"s2643","eng","Figuring out how language works in daily life."
"s2646","eng","I think the purpose of this study is all about perception."
"s2647","eng","No idea"
"s2648","eng","Assess the varying perceptions a group may have on the same given information"
"s2649","eng","To see if people believe in luck or take accountability for their knowledge"
"s2650","eng","to see if the participant can identify what a person thinks about certainty and facts"
"s2651","eng","to read the questions carefully and give good and honest feedback."
"s2652","eng","I am not sure but feel it is used to study word associations to feelings that one may get from a reading."
"s2653","eng","Examine how we understand language. "
"s2654","eng","Whether specific wording and situation impact reading comprehension"
"s2656","eng","to understand the way we think about the observations"
"s2657","eng","test knowledge just read about"
"s2658","eng","To find out how well people pay attention to details "
"s2659","eng","To see how people interpret different situations regarding a """"""""luck of the draw"""""""" type basis"
"s2660","eng","Memory and attention to detail "
"s2662","eng","To figure out perception and reality based thinking and the ideology behind perceptions"
"s2666","eng","I think the purpose of the study was to examine how people interpret language."
"s2667","eng","To see how certain situations stimulates certain words to be used or prefered"
"s2668","eng","I think the purpose of the study is to observe people's perceptions of different scenarios based on how they are worded/presented. "
"s2670","eng","i was not sure what the purpose of the study was."
"s2671","eng","To be able to identify whether people believe things happen by chance or wit."
