"id","survey_lang","purpose"
"s6991","eng","I think that the purpose was to look at the difference of the perspective between believing and knowing. "
"s7029","eng","Gauging the perception of others"
"s7031","eng","I believe the purpose of this study is to assess the bias of online surveys."
"s7061","eng","Determining evidence and fact, based on others perceptions."
"s7066","eng","How language can be phrased to make people believe one thing or another. "
"s7069","eng","maybe to look at the difference between believing and knowing and whether its reasonable to assume right ?"
"s7114","eng","DO NOT USE IN RESULTS. TEST RUN "
"s7119","eng","I think the purpose is to test our conception of belief and how this is influenced by the stories we read. "
"s7150","eng","I think that the purpose of this study was to see how people analyze other people's thought process and how it affects their decision-making. "
"s7201","eng","To try to gain an understanding of how people view the perspectives of other people based on limited context. Perhaps also to test how people read. "
"s7202","eng","Perception of others thoughts and accuracy of those thoughts. "
"s7204","eng","To test our theory of mind when we read stories, seeing how we interpret little discrepancies in language"
"s7225","eng","I think the study may be looking at how people perceive knowledge in different scenarios, or how people differentiate between true belief and knowledge. "
"s7246","eng","To see people's views on belief versus knowledge."
"s7248","eng","To see how well people understand others' experiences/perceptions about the world."
"s7249","eng","Assisting with furthering the scientific knowledge about language and comprehension."
"s7251","eng","I am assuming this is a replication of a language comprehension study looking at how people assign agency and knowledge to the story subjects depending on whether we (the participants) are given information that is not available to the subjects."
"s7252","eng","Language, interpretation and seeing things from others' perspectives."
"s7267","eng","To evaluate how much we believe people make statement with certainty based on accuracy or good luck."
"s7272","eng","To see how much information was retained in response to the events that happened in the readings"
"s7281","eng","How people consider what """"""""knowledge"""""""" is."
"s7284","eng","These scenarios reminded me of the Gettier problem we learned about in philosophy."
"s7291","eng","To see whether we think the consequences people face are being faced because of their own decision or outside forces."
"s7379","eng","Researching the concept of perception versus reality"
"s7401","eng","Maybe something about how we measure the objectivity of things through language; what we perceive as true vs. fake?"
"s7402","eng","To determine the effect of language on an individuals interpretation of a section of writing"
"s7408","eng","to see how people analyse and understand text"
"s7411","eng","To establish what people think is factual correct or incorrect alongside their beliefs on the matter."
"s7433","eng","I think it's about understanding the difference between what people think and what actually is. "
"s7434","eng","To see the association between words and perception. "
"s7436","eng","To get an idea of people's perception of things. "
"s7437","eng","To determine whether people can tell the difference between other people actually knowing things and or just believing things based on (incomplete) tacit knowledge."
"s7465","eng","Language use based on an individuals perception on a situation"
"s7466","eng","To learn about how different people interpret language used in different ways."
"s7468","eng","To find out how learning works based on perceptual fluency"
"s7506","eng","To investigate how language works. "
"s7511","eng","The purpose of this study is to try and remember the events and see how you view other peoples actions because the questions kept asking do you think its reasonable what they did or thought. "
"s7515","eng","Literacy skills, or possibly memory recall"
"s7535","eng","n/a"
"s7537","eng","What assumptions we make of people when we first meet them. If we blame internal or external factors on their misconceptions."
"s7540","eng","The purpose seems to be to gauge how people perceive the knowledge/beliefs of others, and whether knowledge is a fixed concept."
"s7546","eng","To examine the feeling of language of the participant"
"s7549","eng","To comprehend short paragraphs and to understand the difference between knowledge based information and perspective based. "
"s7584","eng","to see opinion of what the characters thought
"
"s7585","eng","People make their decision whether by their ability or their thinking."
"s7586","eng","I think it has to do with the idea of what people perceive to be real versus what actually is real, and whether or not you can judge an individual on what they perceive to be as real."
"s7587","eng","how the terminology used in the paragraph affect the reader's understanding of the paragraph"
"s7603","eng","The purpose of the study was to determine how different scenarios affect the way we think."
"s7607","eng","I think the purpose of this study was to test the idea of a person's belief vs. their knowledge and how each of those may differ based on their set of truths and internal knowledge/expertise."
"s7608","eng","How people have different perceptions of different scenarios and see things differently."
"s7609","eng","To find a pattern between how people identify luck vs skill"
"s7610","eng","to access situations and judge the way people really perceive daily tasks and challenges how much we really know about any given situation"
"s7611","eng","I think that the purpose of this study is to figure out what a person's judgements are towards falsely-believed situations based on the context."
"s7616","eng","Probably to study the relationship between language and human understanding. When using the similar structures in the sentences, whether people will understand them in the same way. However, if the participants are not a native speaker in English, will the results change or get bothered?"
"s7618","eng","To determine people's perception of truth and subjectivity"
"s7619","eng","To determine if people can remember details accurately and based on their memory what they think of a person in a given situation."
"s7621","eng","Something about repetitive options in surveys"
"s7746","eng","To understand how language works to people."
"s7756","eng","To understand how different people can think in relation to the text."
"s7757","eng","All knowledge is important"
"s7758","eng","Maybe to see how different people infer the same situations?"
"s7801","eng","how people perceive situational language in a given concept"
"s7879","eng","How we perceive our world"
"s7891","eng","To see what people's reactions were to certain theoretical situations about looking at the real or not real thing."
"s7896","eng","I think the purpose of this study is to see how certain words influence our decision making"
"s7897","eng","I think it wants to see what people define the behavior of people in these tasks"
"s7898","eng","to understand how people interpret subtle differences in language."
"s7910","eng","TEST"
"s7919","eng","Examine language "
"s7920","eng","No idea."
"s7921","eng","I think the purpose was to understand how differentiate between seeing and believing and whether or the individual was going by his own knowledge or by their own volition. "
"s7922","eng","im not really sure i guess how we think in different situations "
"s7923","eng","To study how language has an effect on perception"
"s7925","eng","To test my knowledge. "
"s7937","eng","understanding the text"
"s7938","eng","something related to trust or human psychology."
"s7940","eng","reading accuracy and remembering details and how questions can influence our thoughts."
"s7941","eng","To determine people's thoughts on perception versus knowledge"
"s7942","eng","Distinguish between facts and actual reality?"
"s7952","eng","I think the purpose of this study is to see how our perspectives of what people know fail to take into account perhaps their limited information. "
"s7953","eng","To understand how different people think and analyze different situations."
"s7960","eng","To be able to understand comprehension of tasks "
"s7961","eng","to test people's thoughts on the difference between knowing and believing the truth? "
"s7962","eng","Reasoning"
"s7963","eng","Potentially a study in judgements of intellectual ability and perception, for example, I trust the ecologist knew it was a squirrel not a groundhog because of his expertise. "
"s7964","eng","I think the purpose of the study is to decide if an individual is wrong or right when the point of view is omniscient, as in the one doing the action is not fully aware of the situation. "
"s7967","eng","I think the purpose of the study was to analyze peoples' approaches to logic and reasoning."
"s7974","eng","To determine how language is used"
"s7975","eng","To see how well the people can perceive or observe interactions"
"s7979","eng","To see how people access a situation and on what variables they put the blame on when something is gotten wrong."
"s7993","eng","To find the distinction between what we believe to know and what we actually know"
"s8017","eng","I have no idea"
"s8025","eng","To see how people perceive situations in which people do not truly know what they are experiencing"
"s8044","eng","to understand one's ability to make a sensibility judgment between reading a story from an outside perspective versus being in the situation yourself "
"s8045","eng","I do not know."
"s8052","eng","The purpose of the study is to see if one can quickly pick up on the little details and figure out the thoughts of someone else."
"s8064","eng","I'm not sure. "
"s8072","eng","TEST"
"s8078","eng","Luck and ability "
"s8079","eng","No idea."
"s8080","eng","TEST"
"s8082","eng","I believe the purpose of this study was to understand how other people think through a number of scenarios. "
"s8084","eng","I think the purpose to show that we do not always know the underlying possibilities of every situation."
"s8085","eng","To asses ones knowledge of deciphering people's thoughts in situations.  "
"s8086","eng","I think the purpose of this study, is to show how much people assume that they know something for fact without taking the time to actually think about it or look closer at it."
"s8094","eng","I think the purpose was to see how different but slightly similar paragraphs can impact reader's judgement."
"s8095","eng","To test peoples short term memory or see how people interpret different language choice"
"s8096","eng","TEST"
"s8098","eng","Not Sure"
"s8099","eng","how we use language and intepret specific choices of words"
"s8100","eng","To identify what we perceive as reality and deception"
"s8110","eng","I believe that the purpose of this study was to see what we believed a person in a certain scenario's knowledge was/is."
"s8112","eng","TEST"
"s8116","eng","TEST"
"s8118","eng","TEST"
"s8126","eng","TEST"
"s8128","eng","To see what I can remember and to see what my common knowledge is. "
"s8129","eng","To understand how different people perceive these situations whether they were based on ability or luck, or whether the people in each scenario were aware of the situation at hand or not"
"s8130","eng","I think the purpose of the study was to try get peoples personal views on everyday events by reading it from another character's perspective. The purpose also, was to see if the participants gave the same answers for all the situations because the endings for two were very similar or if they gave a different answer due to the situation."
"s8137","eng","The purpose of the study was to get a sense of how people view knowledge. The question is how actually knowing something differs from mistakenly believing you know it."
"s8147","eng","no"
"s8151","eng","From what i can see it seems the aim is to asses the way we interpret written language and how we go through balancing the information we are exposed to as to find the conclusion that makes the most sense."
"s8153","eng","Feeling or intuition "
"s8166","eng","to see how our brains judge or respond to the characters and scenarios with the information provided."
"s8167","eng","To understand how people interpret language based on how things are written. Or to see the extent at which people believe in luck vs ability, or just pure coincidence."
"s8174","eng","To try to understand how people understand 'knowing' and 'believing' in something and what is the difference in particular."
"s8179","eng","To ascertain confidence in decision making and perception. To ascertain whether participants believe one can ' know ' something without any uncertainty"
"s8180","eng","To investigate people's responses/judgement."
"s8181","eng","To study theory of mind and see if people can put themselves in someones elses shoes and imagine what they would have been thinking and why?"
"s8183","eng","The ability of how words may portray between what others believe and what they know."
"s8186","eng","to see how language can change people's perspectives on different situations, even though they follow similar judgements in them"
"s8187","eng","n/a"
"s8193","eng","to investigate how use of different language affects peoples interpretation of a scenario"
"s8197","eng","I don't know."
"s8200","eng","to see people's ability to read information and answer questions based on it"
"s8205","eng","The way a person perceives language."
"s8206","eng","How strongly people hold their convictions and whether or not they attribute them to ability or chance."
"s8208","eng","perhaps trying to understand the extent at which people think things happen by certainty rather then chance "
"s8209","eng","Impressions of people and forming attributions about them."
"s8210","eng","I think the purpose of this study is to tell how I perceive people based on their knowledge."
"s8212","eng","to distinguish between knowledge and relative knowledge"
"s8213","eng","I think that the purpose of the study was to see how I perceived situations or scenarios differently based on the way things were worded and phrased."
"s8214","eng","TEST"
"s8217","eng","I don't know"
"s8218","eng","I believe this study is using language to see how we judge people and their knowledge."
"s8224","eng","The purpose of this study is to determine the motivation behind the beliefs of claiming objects as they are or perceived. "
"s8225","eng","N/A"
"s8226","eng","I think the purpose of this study is to see how people initially judge a person. "
"s8228","eng","to test a hypothesis about peoples one sided perspective on certain things."
"s8230","eng","not sure"
"s8235","eng","I think the purpose is to see when people will say a fictional other is correct or not, depending on """"""""fakeness"""""""" of the events as known by the reader (us) in the third person. This is looking at logic and our acceptance of logic and what we do with our knowledge vs what other people know. "
"s8245","eng","No clue"
"s8261","eng","TEST"
"s8271","eng","to investigate how we perceive the actions of people with misinformation "
"s8275","eng","TEST"
"s8277","eng","The purpose was to see what people actually think of when they hear a story it is interesting to see whether or not a person believes in another's claim. It could be true but it could be false. "
"s8280","eng","TEST"
"s8282","eng","I think that the purpose of this study is to better understand how people, in general, understand other's knowledge."
"s8284","eng","To see how people think about luck vs skill"
"s8285","eng","I think the purpose of this study is to examine people's responses with how confident they were in their responses, as well as their consistency in answering the slide questions and the following questionnaire."
"s8286","eng","The purpose of this study is to determine what people's view of truth is.  It evaluates individual's idea of truth vs. a belief."
"s8287","eng","I think it is attempting to figure out how we respond to different phrasing in language. "
"s8316","eng","To see if the participants can remember what happened during the story and answer questions without looking at what they read. "
"s8319","eng","I think that the purpose of this study was to try and figure out how people may believe that something is what they think it is, but without proper knowledge it is unclear. However because they do not have that knowledge they fully believe what they experienced is in fact correct."
"s8326","eng","Im not sure"
"s8327","eng","To see how people will differently interpret these stories and whether or not that plays a role in human language and communication"
"s8356","eng","The purpose of this study was to see how well you could pick apart the answers from the text and understand what was being discussed."
"s8357","eng","The purpose of the study is to figure peoples view of luck and ability in knowledge of analyzing scenarios."
"s8385","eng","To try and pick out key details and reflect upon whether the people in the examples were thinking correctly or not."
"s8391","eng","I don't know"
"s8433","eng","Do gauge an individual perception of what it means to understand something; whether understanding is out of luck or whether the perception is based on mental abilities."
"s8439","eng","To see how language and close reading are related"
"s8440","eng","I'm not sure"
"s8441","eng","I Think the purpose of this study was to see how an individual interprets each situation."
"s8443","eng","I have no idea (It won't let me continue without filling something in this text box)."
"s8444","eng","It could possibly be to calculate how people comprehend reading material."
"s8446","eng","How our ability vs. luck helps us to figure out certain things and what we really know.
"
"s8472","eng","To see how people analyze situations set before them and if things are actually how we perceive them."
"s8490","eng","To study language and how people use different words for different meanings, how people interpret meaning/truthfulness/intent in a situation with language."
"s8494","eng","Finding out peoples interpretations of language"
"s8496","eng","I think the purpose of this study is to see how people judge others on their actions, specifically a actor/observer bias? Or how we judge others while we aren't aware of not knowing the entire story, or how we ourselves are quick to turn to an answer without considering other factors"
"s8500","eng","Specific wording/language can change people's perception of the situation/story they are hearing."
"s8570","eng","To attribute to the study of how we understand things, and to add to the study of knowledge"
"s8573","eng","to see whether we think who was right/wrong in very different events."
"s8584","eng","To test a person's ability to rationalize a scenario"
"s8586","eng","To study whether previous knowledge or luck would be involved in observation"
"s8587","eng","To understand if people think luck matters more than ability."
"s8594","eng","To distinguish peoples point of view"
"s8596","eng","I think the purpose of this study is to find out who is reading through the whole story and who is oaying attention."
"s8600","eng","test"
"s8601","eng","I can't tell."
"s8602","eng","test"
"s8603","eng","no idea"
"s8605","eng","To test logic skills and see how humans respond as a 3rd person viewer of a particular situation"
"s8616","eng","I have no idea"
"s8624","eng","n/a"
"s8625","eng","I think the purpose of the study is to estimate the readers ability to remember certain details in given scenarios."
"s8626","eng","Determine practical theory judgement."
"s8628","eng","To examine how people perceive the knowledge of others"
"s8630","eng","I guess the purpose of the study is to understand people's thought when they read a passage and the character inside has some behavior."
"s8631","eng","To try to find out if people can actually think properly according to the scenario given"
"s8632","eng","Determining difference between believing and knowing."
"s8642","eng","test"
"s8645","eng","to test people "
"s8648","eng","I think it went over reasoning and if people in these scenarios were lucky or unlucky or if readers believed that their ability or inability caused a thought."
"s8650","eng","I believe the purpose of this study was to see if people knew exactly what they were looking at, and to observe their thought process.  "
"s8656","eng","it was well organized and the scenarios were well thought out"
"s8667","eng","to see what the readers think"
"s8669","eng","Relating my believes and knowledge to story telling."
"s8670","eng","To test reading and comprehension skills, while at the same time taking into account the survey taker's opinion on their choices"
"s8685","eng","Maybe to see how people think about actual known truths vs believing its the truth"
"s8687","eng","I think that the purpose of this study may have been to study why we make internal or external attributions for people based on the scenario. "
"s8688","eng","peoples focus to the experiment at hand"
"s8689","eng","understand how people view misleading information and how it affects people who lack this information? not really sure "
"s8691","eng","To see explain how rhetoric frames how we perceive action "
"s8693","eng","no idea"
"s8694","eng","To understand language comprehension."
"s8702","eng","To evaluate how well certain individuals read the details of the scenarios they are given, and how these details affect the judgment of the subjects in the scenarios"
"s8704","eng","perception of situations"
"s8706","eng","n/a"
"s8708","eng","So see how we judged other people's mistakes."
"s8710","eng","justified true belief"
"s8712","eng","To try and distinguish whether the people in the examples were wrong due to luck or skill in their feild."
"s8714","eng","See how people do or do not retain reading information"
"s8715","eng","In my opinion the purpose of this study would be to examine individuals' cognitive capacities in being able to distinguish a proven fact versus a quick assumption. "
"s8728","eng","I think it is related to people's perception of certain situations"
"s8740","eng","To discover how people understand sentences in English"
"s8753","eng","To examine how themes presented in a text could impact the reader's perception of the overall story."
"s8761","eng","TEST"
"s8763","eng","I think the purpose of this study was to show that some people might be fooled in what they believe is actually true, yet the people don't know if it's right or wrong, they just make assumptions. "
"s8767","eng","to figure out what differs in people perspective leads them to their own justifications about the real world"
"s8768","eng","To possibly test our abilities to reason since psychology deals with the study of logic and the reasonings that occur within the human mind. But also to determine, through scenarios, how people can not always be certain of their answers and also of their reasoning through quick determination. "
"s8772","eng","growth vs fixed mindset?"
"s8779","eng","To determine how I define the difference between knowing something and only believing, and whether or not I actual read the prompts."
"s8782","eng","study responses in regard to critical thinking and what is real vs what we think is real"
"s8785","eng","test my reading comprehension."
"s8805","eng","to see how wording affects our views"
"s8813","eng","TEST"
"s8814","eng","TEST"
"s8817","eng","TEST"
"s8821","eng","Read and understand the context"
"s8822","eng","I have no idea"
"s8823","eng","research reading comprehension skills"
"s8825","eng","This study is trying to show the difference between belief and factual knowledge which we often mistakenly confuse as one or the other "
"s8827","eng","To understand individual's reading comprehension and speed. "
"s8830","eng","I felt the purpose was to find which way people would sway."
"s8831","eng","The purpose of the test is to test for bias and how people self-attribute such that if people personally mess-up, it's bad luck; if others do poor, it's ability. "
"s8833","eng","to gauge critical thinking skills"
"s8834","eng","Reason over intelligence"
"s8836","eng","to detremine reality vs not"
"s8837","eng","To figure out the philosophy behind the difference between knowing and feeling like knowing from both an omniscient thrid-person view and, by trying to sympathise with the characters, a first-person view."
"s8839","eng","Tes"
"s8850","eng","I think the purpose of this study is to understand how language affects the understanding of a situation. "
"s8856","eng","To determind how people know what they know."
"s8857","eng","To measure perce[tion"
"s8858","eng","To see how survey takers respond to strange questionaires"
"s8872","eng","To show that there is no right or wrong answer. Everyone is entitled to their own opinion "
"s8873","eng","Survey how aware people are of the limits of their perception. They can perceive things and make assumptions based on past experiences, but without expert knowledge and multiple viewpoints, they can't know things. Also maybe investigate how people use the word 'know'."
"s8874","eng","To rate/ analyze an individual's belief system based on a certain scale."
"s8875","eng","I have no idea"
"s8877","eng","Possibly to see how much attention people pay to blocks of text in a study."
"s8879","eng","theory of mind
language and how we adapt to scenarios"
"s8880","eng","not sure"
"s8882","eng","I feel like this study was about perception."
"s8891","eng","No idea"
