"id","survey_lang","purpose"
"s14928","eng","hmm i think it has something to do with what we take as truth, does the true truth matter or are we satisfied with believing we know the truth, how much it matters that we may not know the true truth, and how far we're willing to go to chase the true truth"
"s14929","eng","to determine what we think about people's thoughts on items that aren't what they are"
"s14930","eng","Perception of luck compared to reason "
"s14931","eng","To understand how people interpret what they read."
"s14932","eng","distinguish luck vs. ability"
"s14933","eng","No idea"
"s14934","eng","to see how people consider the credibility of other people's knowledge depending on context"
"s14937","eng","im not sure"
"s14938","eng","To see if people understand the difference between luck and knowing something. Because we might 
 think we know something but our answer might be depending on luck to get the right answer while we can answer some questions the right way because we already have the knowledge for the subject we talking about."
"s14940","eng","Making decisions with limited information or feeling uncertain."
"s14948","eng","The purpose of this study was to see if someone could spot the difference vs two different things."
"s14952","eng","The purpose of this study is to shed light on how people perceive the concepts of luck and ability in real life."
"s14958","eng","To figure out what people mean when they say """"""""know"""""""" (i.e., can people know something out of ignorance, like that man pointing at houses.)"
"s14959","eng","Whether things are in ones control or they blame their wrongdoing on external factors."
"s14962","eng","I believe the study is to see whether an external party can determine someone's confidence in their answer based on queues, but I'm not sure"
"s14963","eng","To find out how different perspectives qualify as right or wrong "
"s14965","eng","to see if one would pay attention to a written prompt."
"s14966","eng","understand how people classify luck, ability, belief and knowledge "
"s14969","eng","To find how people's believe of luck is in relation to ability to correctly assess something."
"s14970","eng","To try and determine the subjective difference between knowledge and belief. Because objective facts are very hard to actually come by."
"s14972","eng","I believe the purpose of the study is to determine at which level of ability, justification, and general reasonability of an individual's statement change that statement from just a belief to knowledge."
"s14973","eng","To determine how luck affects decision making"
"s14975","eng","To demonstrate how easily it is to manipulate the eye."
"s14976","eng","The purpose of this study was to discover people's ability to analyze the difference between good luck/bad luck or their ability/inability with a given scenario."
"s14978","eng","To get people's opinion on knowledge versus belief"
"s14982","eng","To understand how people think"
"s14983","eng","To determine whether people attribute luck or skill more to the success or failure of an activity."
"s14984","eng","To discern what people think they know and what they believe to be facts."
"s14985","eng","To see how well the participants pay attention to the detail of the story"
"s14987","eng","To try and understand different people when they read different scenarios"
"s14989","eng","to look at how language is used to distinguish perceived ability or skill. "
"s14994","eng","Maybe the study was about how different people view different things."
"s14995","eng","no idea"
"s14996","eng","I did the purpose of this research was to see how well participants comprehend stories. "
"s14997","eng","I think the aim was to see whether people attribute situations to be something that is known or just believed to be known."
"s14998","eng","be able to understand different situations and make out what is actually going on"
"s15004","eng","To establish the difference between luck and knowledge. "
"s15006","eng","To identify how people perceive luck and knowledge."
"s15007","eng","to see how people interpret information"
"s15008","eng","To determine if participants credit the results of their decisions to luck or their ability."
"s15009","eng","i dont really know "
"s15010","eng","no"
"s15012","eng","To determine what makes someone right or wrong based upon external or internal factors."
"s15013","eng","To understand a persons reasoning and thought process after given a scenario"
"s15014","eng","no clue"
"s15016","eng","Possibly to study how opinions can differ in situations when presented with all of the facts? Not super sure."
"s15017","eng","Determining the consensus for beliefs about knowledge and luck"
"s15018","eng","If study is based on belief or knowledge"
"s15020","eng","no idea"
"s15021","eng","i have no idea"
"s15022","eng","To asses demand characteristics in studies."
"s15025","eng","It is about our perceptions of reality and whether we can consider someone to know something for certainty, even if there was an element of luck in the fact that they got the correct answer. Based on the information available to the person they may know the correct answer, but there may be unknown factors that could have potentially impacted the reality of the situation. So do we consider them to be correct based on their knowledge or their luck?

Either that, or this is a meta-study about participant engagement in a survey."
"s15028","eng","The purpose of the study may have been about peoples memory after reading short stories or about how people interpreted the material. "
"s15029","eng","To see how people judge luck compared to ability. It might also be about surveys"
"s15034","eng","n/a"
"s15035","eng","I don't know"
"s15038","eng","luck vs. ability"
"s15042","eng","To test perception"
"s15043","eng","I believe it mentioned  at the beginning that the purpose was to look at how language works. "
"s15044","eng","to understand perception "
"s15045","eng","to see how people interpret stories and words"
"s15046","eng","Maybe to test the validity of the study to see if people actually read the text."
"s15047","eng","To see how well people grasp the complexities of the english language"
"s15049","eng","To see how people interpret situations and if people were focused in this study"
"s15052","eng","Knowledge vs. luck"
"s15053","eng","To understand the process of assumptions and their validity"
"s15055","eng","I think the purpose of this study was to test how people would respond to practically the same scenarios with a few key changes and wording differences. That or this study is just about what we perceive the study to be about which is why I am answering these post questions."
"s15059","eng","What the eye sees is not necessarily true"
"s15060","eng","Possibly to see what we think about a situation when we have an all knowing outside perspective."
"s15061","eng","no idea"
"s15064","eng","to gain an understanding how people apply reason/knowledge with luck/ability"
"s15065","eng","I don't know"
"s15067","eng","To see if people know/don't know what they are talking about based on their ability or based on their luck."
"s15069","eng","To calculate how the participants perceive whether an action is recognized by luck or intellect."
"s15071","eng","to compare how students make decision based off of similar materials"
"s15072","eng","To see if we could understand situations by wording and also seeing our perspective on certain situations and how we consider outcomes "
"s15073","eng","Analyze problem solving and critical thinking?"
"s15076","eng","I think the purpose of the study was to uncover the true opinions of others"
"s15077","eng","Something to do with people's perception versus reality."
"s15078","eng","to show people mistakes are common"
"s15082","eng","To determine how wording a scenario directs how the reader perceives the awareness/incompetency of the subject's actions."
"s15085","eng","To break down how people perceive knowledge and new information in the context of legitimacy."
"s15090","eng","to first identify what each individual felt and knew versus the reality of it "
"s15093","eng","I think the purpose of this study is to for surveyors to tell if the belief and true knowledge is justified.."
"s15096","eng","Perception of luck vs ability when people get the answer right vs. wrong. "
"s15097","eng","i am not sure"
"s15099","eng","I feel as if it may have something to do with perception and trust."
"s15100","eng","I think the purpose of this study is to make people understand that some statements we make about the way we perceive the world are not always factual."
"s15101","eng","How language affects the way we think of things. How we decide luck or it was ability."
"s15102","eng","To distinguish between the difference between knowledge and luck."
"s15105","eng","To see how people perceive things and their opinions about scenarios. "
"s15106","eng","Ability/Inability vs. Good luck/Bad luck but I do not understand what is meant by ability/inability when it comes to determining if something is real or not."
"s15109","eng","To show how much you pay attention to the situation."
"s15112","eng","To try and see how people view good luck and bad luck."
"s15118","eng","idk"
"s15122","eng","I think its about how people perceive certain situations"
"s15126","eng","to maybe discover how people can interpret stories differently"
"s15128","eng","rating thoughts"
"s15129","eng","to see how different people may interpret messages differently"
"s15132","eng","Understanding perception and how it can translate to knowing"
"s15138","eng","To test how language affects my perception of whether a person experienced something because of luck, or ability"
"s15143","eng","To see if participant have read the questions "
"s15145","eng","Decision-making"
"s15148","eng","seeing what people think"
"s15150","eng","To identify if we have critical reading skills"
"s15158","eng","How language works"
"s15162","eng","no idea"
"s15164","eng","To avaliate how people relate ability and luck "
"s15167","eng","to find the knowledge and beliefs of others"
"s15168","eng","Beliefs about knowledge and luck
"
"s15173","eng","See if the participant can distinguish between luck and knowledge in situations. "
"s15174","eng","no idea"
"s15178","eng","Beliefs about knowledge and luck
"
"s15179","eng","to find the knowledge and belief of others"
"s15180","eng","No clue"
"s15182","eng","To determine how people view or think about different situations"
"s15185","eng","The purpose of this study is to determine the difference between being aware of actually knowing something that is true or believing."
"s15186","eng","To show that what we may believe to be factual, could only be mere belief depending on the circumstances. To show that the line between fact and belief is often very thing. To question the truth (how can we truly know something is factual if we do not have every little detail at our disposal)."
"s15188","eng","differentiate knowledge from beliefs "
"s15192","eng","I do not know."
"s15193","eng","To test out philosophical stories and the psychology of decision making."
"s15195","eng","To see how the human might function in certain settings."
"s15198","eng","To determine the difference between what we know and what we only think we know."
"s15199","eng","To what extent knowledge helps people not to rely on luck."
"s15200","eng","to compare how students make decisions based on the information they are given "
"s15204","eng","to see how well a person understand a situation "
"s15207","eng","To see how positively/negatively people think and react to situations. "
"s15211","eng","To make participants consider others thoughts on what is right and wrong or what is true and false. To consider if one is being deceived and how it can effect the mind. "
"s15213","eng","Perhaps how we assess an individual's certainty or validity for statements (luck or ability?), based on context."
"s15216","eng","to see how well people can evaluate situations if its based on luck or knowledge with the given information"
"s15218","eng","Understanding beliefs about luck "
"s15226","eng","I think the purpose of this case study was to see how people interpret scenarios"
"s15234","eng","have an open mind"
"s15236","eng","to see if you could use your memory of the scenarios that you read, to answer the question. "
"s15241","eng","The purpose of this study was to analyze the text and decide whether the person believes if everything they view is real or fake."
"s15247","eng","Dont know"
"s15250","eng","To see whether people believe being right or wrong about something that is out of their knowledge is based on luck or knowledge."
"s15251","eng","The purpose was to determine whether different people had more of a skill/ability or a chance/luck mindset"
"s15252","eng","Between luck and certainty"
"s15254","eng","To show the difference between people thinking they know something vs. actually knowing"
"s15255","eng","To analyze the effects of unknown changes to a human's knowledge"
"s15261","eng","It seems as if this study is aimed to study people's perception of specific situations in regards to what is actually real and isn't based on some background information."
"s15265","eng","See peoples responses."
"s15267","eng","Unsure"
"s15269","eng","I think the purpose of the study is to analyze whether or not participants believe something can be true without an individual knowing the whole truth. Ex. the necklace could have been diamonds whether or not the customer truly knew if it was. If the customer believes and says """"""""it is made of diamonds"""""""" when really the necklace is cubic-zirconia, is the customer lying?"
"s15270","eng","to look at my beliefs and opinions"
"s15277","eng","I think the purpose of this study is differentiate between what you feel is correct or not and whether or not you are actually correct. "
"s15279","eng","to see the way we think"
"s15281","eng","The purpose of this study was to see how much knowledge the reader could obtain. "
"s15284","eng","The purpose was to determine what knowledge and luck are classified as to the general public."
"s15290","eng","dunno"
"s15292","eng","To understand people's perspectives."
"s15293","eng","to determine if people know the difference between someone knowing something or just guessing and getting lucky"
"s15294","eng","To see how much people  are willing to attribute things to luck rather than expertise."
"s15298","eng","get data"
"s15299","eng","I like how the test is on people's perception of different scenarios and beliefs."
"s15300","eng","To see peoples perspectives on situations that are about knowledge or luck"
"s15303","eng","Makes the reader think about our perceptions and whats actually real."
"s15307","eng","I think the purpose of this study is to see what people belive they are making the right or wrong choices or if they just think they are "
"s15308","eng","to see how many people belive in luck vs cause and effect"
"s15310","eng","IQ"
"s15311","eng","no idea"
"s15317","eng","To see different perspectives"
"s15321","eng","measure peoples estimations"
"s15322","eng","peoples perceptions of assuming or believing something because of prior knowledge on that thing."
"s15323","eng","am not sure maybe you are trying to find out what people perceive "
"s15324","eng","To see which perspective my answers come from. Either from the protagonist in the story or from the narrators perspective."
"s15325","eng","n/a"
"s15327","eng","beliefs"
"s15330","eng","To see the way different people think of different situations "
"s15332","eng","Not sure"
"s15337","eng","The Framing Effect "
"s15338","eng","I think is to check how people differentiate the two things: distinguishing an object with several reasons, and just speculating without knowing the object is real or fake. All using third person view."
"s15339","eng","I think the purpose of this study is to see how different people react and answer to different situations. And, possibly see their logic towards it."
"s15340","eng","something along the lines of seeing if things happen by chance or fait"
"s15343","eng","Do get a gauge of what people consider """"""""truth"""""""" to be."
"s15346","eng","I think the purpose of this study was to determine if a scenario was purely based on luck or ability."
"s15349","eng","to examine the psychological process that someone goes through in regards to different situations"
"s15352","eng","How people interpret and give out information to others based on their beliefs, what they believe to be true"
"s15356","eng","To understand how people read certain situations"
"s15357","eng","not sure "
"s15358","eng","I have no clue"
"s15359","eng","I believe it was to highlight the fact that our brains can actually trick us into thinking that we see something when in reality it is not there. "
"s15362","eng","Analyzing what we believe to be true versus what we know to be true, and how the two may intertwine."
"s15364","eng","Debunking facks vs luck "
"s15366","eng","Not sure"
"s15368","eng","NO"
"s15369","eng","If people just get lucky or if they have bad luck."
"s15370","eng","not sure "
"s15372","eng","to determine how different people perceive social skills like understanding a person ability/inability to do something"
"s15373","eng","no idea"
"s15380","eng","I think the purpose is to see if recalling details from a story, depends on how the story is phrased."
"s15383","eng","To see how you judge someone??"
"s15391","eng","To understand the difference between luck and ability"
"s15395","eng","I think that the purpose of this study was to see how people classify the credibility of information and whether a person should be faulted for believing """"""""wrong"""""""" information."
"s15398","eng","To determine if people make decisions off gut feelings or on actual obtained knowledge. "
"s15405","eng","To determine whether people credit the things that happen to them to their ability or their luck."
"s15407","eng","To see how people interpret luck and beliefs vs. actually knowing something"
"s15409","eng","I don't really know, I have 2 different ideas,
1. the idea of the OSSLT and how some students don't read the items in full
2. to see what most people can view from the way something is written"
"s15410","eng","Do determine whether people credit their decisions to their ability or luck."
"s15412","eng","to see how people interpret wording"
"s15417","eng","Decide how many people believe in luck"
"s15420","eng","to see how reading associates with answering questions"
"s15421","eng","How we interpret people's knowledge depending on the situation, or how valid it is. "
"s15425","eng","I have no idea."
"s15435","eng","I think the purpose of the study is to understand to what extent people think knowledge can exist, as opposed to strong belief, and how this is expressed through language."
"s15439","eng","Discrepency between beliefs and luck/ability."
"s15443","eng","To examine how context effects out perception on others beliefs."
"s15444","eng","I do not know, maybe to get a sense of what is real or fake"
"s15450","eng","To see how people think about the different scenarios and how different their point of view about the situations is "
"s15451","eng","to investigate whether wording can confuse us into believing certain fact/unreasonable fact "
"s15453","eng","to understand how language is used to determine skill and luck"
"s15455","eng","Test attention"
"s15457","eng","Debunk the notion between luck and ones abilities"
"s15460","eng","to put us in real life situations"
"s15461","eng","to test people on their perception."
"s15462","eng","Possibly to define whether or not situations that are not easily perceived can be attributed to a persons luck vs ability to know something."
"s15463","eng","to identify if participants actually read the paragraphs"
"s15464","eng","I felt that I had to second guess myself when it came to each question because it seemed like a trick question. Therefore, I feel that it revolves around that. "
"s15472","eng","comprehension"
"s15473","eng","see our knowledge"
"s15474","eng","To see how people perceive things and whether their assumptions or statements are valid"
"s15484","eng","To recognize our decision making and critical reading abilities"
"s15487","eng","Maybe to gauge people's beliefs/thoughts about what constitutes luck/ability"
"s15490","eng","To determine whether people believe events occur because of luck or because of their rationality and to determine whether we hold human rationality as the driver of society."
"s15492","eng","Possibly about determining perceived competency?"
"s15499","eng","To measure the participants attention to detail"
"s15500","eng","I have no idea but I think it has to do something with making decisions when you are uncertain."
"s15501","eng","To understand a situation and analyze the situation."
"s15504","eng","I don't know."
"s15505","eng","The purpose might have to do with how well we do in understanding/correctly completing this study based off of how many studies we have been apart of in the past."
"s21015","eng","TEST"
"s21030","eng","purpose of language"
"s21077","eng","no"
"s21102","eng","Culturl differences in attributions"
"s21103","eng","framing effect and attentional biases"
"s21104","eng","To see if we rely on external factors more when deciding something is a fact or a belief"
"s21105","eng","Testing our thought process of the situation"
"s21106","eng","Perhaps it is to determine people's cognitive thinking patterns"
"s21107","eng","Identifying how certain words or context can change our perceptions"
"s21108","eng","It is to test our ability to remember information"
"s21109","eng","to see if people think good luck or bad luck is related to their ability"
"s21110","eng","To find out if people have good or bad reactions when something that is not within their control happens"
"s21111","eng","I think the purpose was to understand what people know and what they believe in are 2 different things."
"s21112","eng","how people judge a situation where they know the outcome but the people involved do not know"
"s21113","eng","To examine how other situational factors affect our certainty of knowledge we had beforehand "
"s21114","eng","Perceptions of good/bad luck in decision-making"
"s21118","eng","understanding how individuals perceive other peoples decision making"
"s21119","eng","to check our attentiveness"
"s21121","eng","I think it is to see on what extent is our perception external or internal based. "
"s21122","eng","To assess English language skills"
"s21124","eng","Not sure:) "
"s21125","eng","nil"
"s21126","eng","testing of language and understanding of the stories"
"s21128","eng","To gauge perceptions"
"s21129","eng","looking at the way people perceive things and from a 3rd party perspective"
"s21131","eng","interpretation of language"
"s21132","eng","Perceptions of whether people think a mistake made is out of ability or luck"
"s21133","eng","No idea"
"s21135","eng","To find out how we perceive people's wrong conclusions."
"s21136","eng","not sure"
"s21138","eng","nil"
"s21157","eng","to determine how one's opinion is affected by the circumstances around them"
"s21159","eng","To find out if certain circumstances are attributable to one's luck or one's ability."
"s21160","eng","Determine perception towards right and wrong"
"s21161","eng","the purpose is to test out how the context will affect what we know or what we think we know"
"s21162","eng","To test on whether participants' intuitive of their various scenarios would change based on what was stated on the paragraphs (whether they are knowledge of the topic)."
"s21165","eng","To study how one inteprets a paragraph and how the phrasing will affect how people view the people in the scenario"
"s21166","eng","I think the prupose of this study is to test whether participants are idea to identify things in real life and to be able to tell between a fake and a real"
"s21167","eng","to test our understanding of the text that was given to us"
"s21169","eng","people's perception"
"s21170","eng","Test how we perceive honest mistakes? Seems a bit obvious, but unsure overall"
"s21171","eng","To understand the predicament that the subject in the case example is in. Not fully sure as well."
"s21172","eng","i think the purpose of the stidu is to find out about the perspective of individuals when they think they are right but instead they are wrong"
"s21173","eng","nil"
"s21175","eng","perception of the situation"
"s21176","eng","To access whether we perceive things as good or bad. Not sure!"
"s21177","eng","Alertness on boring task?"
"s21178","eng","Perception"
"s21179","eng","Ability to read and understand long passages"
"s21180","eng","not sure"
"s21183","eng","dont know"
"s21185","eng","To understand our perception"
"s21186","eng","To see how one understand different scenarios and see if its luck or natural "
"s21187","eng","Investigate cognitive responses and self-esteem afterwards"
"s21188","eng","I guess this is about how we perceive what we see and what we know?"
"s21189","eng","attribute decision making to the different circumstances"
"s21190","eng","To evaluate if we think that a person' ability to identify things in their environment is based on a person's luck or ability. "
"s21192","eng","to determine a perception based on a given circumstance"
"s21193","eng","about individuals perception?"
"s21194","eng","The purpose is to evaluate an individual's perceptions on issues that seem controversial and both answers might be correct."
"q_turk_R_3Jkf33SWw1HeToN","eng","None."
"q_turk_R_1gO1YjCdNVhlpus","eng","None"
"q_turk_R_3LhBK9tXvx3SQAU","eng","I think the purpose of this study is to evaluate responsibility in relation to knowledge."
"q_turk_R_1KN4WW9BSoaQWHv","eng","who is to blame for the different situations"
"q_turk_R_2zTr8jsK388GOyG","eng","None"
