"id","survey_lang","purpose"
"s11540","eng","Reading comprehension or maybe to try and get into the minds of what these people in the paragraphs are thinking in certain scenarios"
"s11543","eng","I am not sure"
"s11556","eng","a look at 
Good/Bad 
Right/Wrong
According to one's beliefs - what they know to be true based on either 'trusting the source of information', or from their experiences of knowledge to date"
"s11557","eng","Not quite sure but i assume something to do with the perception of truth/reality. "
"s11560","eng","Would love to know"
"s11571","eng","To measure information comprehension and retention "
"s11573","eng","Not sure"
"s11579","eng","Potentially looking at interpretation? "
"s11597","eng","To explore how using certain words or sentences affects the reader`s ability to fully understand the situation that had been written about."
"s11599","eng","To assess the way people think about logic and apply this to others."
"s11600","eng","how I interpreted the writing."
"s11603","eng","no idea"
"s11612","eng","Comprehension of the text"
"s11638","eng","Maybe to test the human brains tendency to assume it is always correct or the tendency of believing the easier and more common opinion."
"s11646","eng","The extent that knowledge you possess is assumed to be shared with other people. E.g I know that the house was a real house and therefore the person in the scenario should have shared this same experience akin to experiments in social cognition.  "
"s11648","eng","To test comprehension memory "
"s11656","eng","Something about how people distinguish facts and opinions."
"s11657","eng","I think the purpose of the research is to find the certainty or uncertainty someone has in regards to object, nature, and life in general."
"s11661","eng","I think it is trying to understand the nature of language in conveying the real nature of situations."
"s11676","eng","To stress and recognise that reality is different from the beliefs... "
"s11678","eng","If you have no idea for the purpose of the study, the field may remain empty."
"s11680","eng","se different thoughts of people"
"s11684","eng","How different people perceive different situations."
"s11689","eng","Possibly to see how the use of certain words/phrases influences a person's interpretation of a passage"
"s11693","eng","Perspective of the person depends if he/she had all the available information. "
"s11696","eng","I think its just the different structures of each scenario and how people interpret each one. Looking back they could probably all have the same answers depending on what way you take it and yet my answers were different, Or i could be way off! lol"
"s11697","eng","maybe hoe language influences perception/opinion "
"s11708","eng","To gain perspectives on certain situations as well as forming an opinion off the way the situation was described."
"s11709","eng","At first I thought it was about comprehension or maybe even grammar trying to trick the reader into believing something. But I can't say for sure what I think the purpose was."
"s11710","eng","To see individuals ability to comprehend and judge a situation."
"s11712","eng","To understand the different minds and the way each individual will think of each scenario. To see how each person thought of the story and what they understood from it.  "
"s11715","eng","State purpose was on how language works but not sure. Most of the questions ended up being on beliefs about how true information was."
"s11717","eng","To determine how people understand language and how it is presented"
"s11718","eng","I do not know. Maybe, looking at how language is used to build certainty in our analysis of a situation. "
"s11719","eng","Peoples perception of different situations"
"s11720","eng","To get the participant to think about the questions and answers in relation to the scenarios."
"s11723","eng","to see if peoples judgement is based on knowledge or situational luck "
"s11724","eng","To test how well the participant would retain information, and to test also how much of a persons opinion can say an open/closed question"
"s11728","eng","TEST"
"s11729","eng","To understand how people might have different reactions or perceptions of different scenarios."
"s11730","eng","TEST"
"s11737","eng","Unsure"
"s11738","eng","to see peoples point of veiws on what other people see"
"s11739","eng","to see how people veiw other peoples views and if they are right or wrong"
"s11740","eng","Not sure"
"s11741","eng","I felt as though this study aims to discover if readers can differentiate the difference between what is known, and what they believe they know."
"s11744","eng","Studying peoples theory of mind "
"s11749","eng","may have implications for criminal justice, because it mentioned the idea that believing that you know something isn't the same as actually knowing it. It could be useful for analysing the language used in depositions "
"s11755","eng","The comprehension of readers "
"s11756","eng","I am not sure but I had to justify my opinion when answering my questions about the different scenarios. "
"s11757","eng","For an individual to read a small paragraph and be able to depict appropriate answers to the questions provided to them. "
"s11759","eng","To see how different syntax can affect the interpretation of stories or texts."
"s11766","eng","to test compression. "
"s11768","eng","not sure"
"s11769","eng","To study language or possibly how people use language to explain certain situations "
"s11771","eng","Understanding how well we are at explaining a situation with differences in language."
"s11773","eng","To analyze the impact of language over perception. "
"s11776","eng","I have no idea."
"s11778","eng","For researchers to learn more about language but other than that, not sure."
"s11779","eng","I think the purpose of this study was to figure out whether or not language and how it is used is able to effect what is trying to be conveyed."
"s11783","eng","I think that the purpose of this study is to investigate people's perceptions of situations and conditions they believe they are in."
"s11786","eng","To see how language is important"
"s11787","eng","To discern how people distinguish knowledge and belief"
"s11793","eng","I think it might be testing how our perspective would influence our answer."
"s11796","eng","No clear idea"
"s11800","eng","perhaps to assess what people deem to be knowledge vs beliefs"
"s11803","eng","To determine if the language of questions influences one's answers. "
"s11804","eng","How environments solidify/confirm what people believe to be facts "
"s11805","eng","That someone can't realize when something is real or fake."
"s11806","eng","To test how language effects the perspective of a person."
"s11807","eng","The purpose was to see if launguage is really what people think "
"s11809","eng","Identify understanding of the language. Distinct between what is real and what is a belief. "
"s11810","eng","I think the purpose of this study was to see individuals perspectives in different scenarios."
"s11811","eng","the purpose of the study is to know about language."
"s11813","eng","comprehension"
"s11814","eng","To see how the way things are worded changes how people answer questions related to a story."
"s11815","eng","To see how people perceive things. To see if they know what they want or just getting/looking at something they think they want. Challenging people's ideals based on if they know what is real or fake."
"s11817","eng","to determine the effect of language on outcome (belief)"
"s11818","eng","I believe the purpose of this study is to study the different perspectives of people and how they view their surroundings."
"s11820","eng","not sure"
"s11821","eng","to understand human perceptions of different stories and whether the language or backstory was believable through choices of language "
"s11822","eng","Reading comprehension and our perceptions of the world"
"s11823","eng","If aware you are of knowing the truth and if it is really the truth"
"s11824","eng","To see if we have reading comprehension and how much information we can retain."
"s11825","eng","To understand how people respond to variety of meaning and perception of truth "
"s11826","eng","They were discovering whether people using language appropriately or inappropriately do so consciously or unconsciously."
"s11827","eng","I think the purpose of the study was to see if individuals could look at the facts of a paragraph and view it from the perspective of a individual to determine if they were right or wrong in their beliefs and statements "
"s11828","eng","to examine my english ability and visually represent the sentences in my imagination "
"s11843","eng","how language can change and shape our understandings of similar situations worded differently."
"s11845","eng","No"
"s11846","eng","On focus and attention span"
"s11847","eng","N/A"
"s11848","eng","I have no idea"
"s11850","eng","I think that the purpose of the study is to understand the attention span of individuals and testing it through asking questions about the case studies."
"s11853","eng","I feel that the study is to determine how different people read different things and how much attention is given to readings"
"s11854","eng","To examine perception"
"s11855","eng","i believe the study is related to perception, how people might be fooled  by the environment"
"s11858","eng","to identify peoples reasoning "
"s11861","eng","I believe the study is to help us recoginize how everything in life may not be exactly what we believe it to be. This can be at the result of chance or pure ability. "
"s11862","eng","How easily we can get confused and misinterpreted a story we read by loosing focus"
"s11863","eng","to see how people can interpret the same information completely different. "
"s11864","eng","the purpose of the study is to see if we understood what  we were reading"
"s11869","eng","To see how English can be interpreted depending on the syntax ?

Or to see the salient ideas people get out of any text, by seeing their interpretation after with the questions (since we can't recall the entire text, only the important aspects that ultimately creates the narrative after reading it and recalling)

I have no idea though."
"s11870","eng","reading comprehension"
"s11871","eng","The purpose of the study was to understand how the wording in a piece affects the interpretation of the person reading it. "
"s11872","eng","To study language and the understanding of language."
"s11874","eng","measure people's ability to think "
"s11875","eng","i thought it was how language works, doesn't seem to be the case?"
"s11878","eng","to find out, if we are paying attention to what we are studying"
"s11884","eng","how quickly we identify, what is in the story given/"
"s11890","eng","try and understand people understanding in a scenario"
"s11891","eng","I am not sure. Possibly to figure out how sure we are of what we see/read."
"s11893","eng","To see how wording has an effect on how the reader interprets a text"
"s11896","eng","I think the purpose of this study is to help me interpret and evaluate each scenario's situation of whether a person (Gerald, Emma and Darrel) discovery in an object through luck or with their own ability. "
"s11897","eng","Im not too sure"
"s11899","eng","To decipher if it is knowledge or luck?"
"s11900","eng","To see how language impacts a persons's understudying of a storyline, comparing the knowledge of the characters in each story and the knowledge of those reading"
"s11902","eng","Exploring context and knowledge that an individual has or does not have in relation to that context / circumstance. Thus influencing terminology used."
"s11904","eng","I think the purpose of the study was to understand how language works and how we understand stories that can be confusing in regards to what the character experienced."
"s11905","eng","To determine the ways people interpret information"
"s11909","eng","Whether the suggestive language affects the readers perception"
"s11910","eng","to determine people's perception of reason?"
"s11914","eng","To see how well we interpret things"
"s11916","eng","to know-reality
believe-trust, imagination"
"s11917","eng","Do understand how people perceive what is known and what is believed to be known by presenting circumstances representing this. "
"s11924","eng","interpretation of the message"
"s11925","eng","I think the purpose of the study is to see, based on our language, how well we are able to understand different scenarios. "
"s11929","eng","How we interpret the short story we read."
"s11932","eng","reading comprehension and memory"
"s11933","eng","To see how people perceive wording in short stories."
"s11936","eng","to try to differentiate what you think is real. some things might look real but they are not.  "
"s11937","eng","our ability to recognize what is real and what is not."
"s11938","eng","How people interpret ignorance. "
"s11940","eng","Reasoning, How people perceive different situations. Whether in a positive or negative way.
"
"s11942","eng","I think the purpose of this study may have been related to comprehension skills, or possibly the theory of mind concept "
"s11949","eng","not sure"
"s11950","eng","To see how good your reading skills are."
"s11951","eng","To further investigate our abilities in comprehending language. "
"s11952","eng","Not sure"
"s11953","eng","to assess language comprehension"
"s11955","eng","Understand people's grasp on language and comprehension"
"s11958","eng","unsure "
"s11962","eng","to gain an understanding of differing peoples understanding of particular words or phrases and how they logically apply them to situations. if someone doesn't know there is an alternate possibility, is there correct/ incorrect assumption of something luck or knowledge."
"s11991","eng","How individuals interpret situations."
"s11999","eng","i did not get the purpose of the study"
"s12000","eng","To see how some people understand certain situations depending on the wording"
"s12005","eng","I think the purpose of this study was to evaluate how effective someone's understanding of what they read were. If they could memorize the memory correctly and completely understand what is going on in the story. "
"s12007","eng","To know if individuals understand what they are reading "
"s12020","eng","To see if people can comprehend language."
"s12024","eng","To test how people analyze possible situations. Whether people take answers into considerations or jump to conclusions"
"s12027","eng","I think the purpose of this study was to see how well the participants grammar is. "
"s12038","eng","The purpose of this study was to study..."
"s12054","eng","to test the ability to understand the passage in english"
"s12068","eng","To see if someone will read all the details before drawing conclusions"
"s12069","eng","To find out how people interpret certain situations."
"s12087","eng","To see how the way something is written impacts the readers opinion"
"s12089","eng","It might be how different situations are from what we perceive"
"s12182","eng","To analyze different thought processes."
"s12183","eng","How people can have different perception of things."
"s12193","eng","To understand different scenarios with various language and sentence structures, and be able to identify true and false information of the characters. or some other subconscious psychological thingy"
"s12219","eng","The purpose of this study is not clear "
"s12223","eng","to analyze the level of peoples reading interpretation "
"s12243","eng","How language can affect our impressions."
"s12248","eng","to see if you cn read and remember the scenario"
"s12289","eng","To find out how people interpret others actions."
"s12299","eng","TEST"
"s12303","eng","Comprehension and identifying the difference between knowing and believing. "
"s12305","eng","I am not sure what was the purpose of this study"
"s12306","eng","I "
"s12308","eng","How people interpret a passage"
"s12312","eng","I feel like the purpose of this study was to be able to determine whether the person in the scenario can differentiate between what is real and what it not, using a third person perspective"
"s12313","eng","I dont know what the purpose of this study is "
"s12315","eng","I believe this study was to test the participants (like myself) ability to read and comprehend short scenarios. "
"s12323","eng","I have no idea. I know by the title of the research that it was a language study. "
"s12327","eng","To record one's understanding and attention span"
"s12335","eng","Test"
"s12347","eng","I believe the purpose of this study was to measure how people infer information differently. "
"s12372","eng","Test"
"s12390","eng","To see how much attention i paid to the scenario? Or to see how trusting i am of situations"
"s12430","eng","Test"
"s12446","eng","the purpose is probably to see how people feel about taking part in psychological feedback"
"s12511","eng","No ideo"
"s12515","eng","No idea."
"s12519","eng","To see how much someone is paying attention to what they read and how things are worded "
"s12522","eng","How we depict things according to our perception and a specific situation"
"s12523","eng","understand language"
"s12525","eng","I think you are trying to show how people react differently about peoples's mistakes depending on the situation. Some may think it is reasonable for Darrell to be mistaken about that species but unreasonable for the woman to buy fake diamond thinking its actually real. IN its essence, the mistake is the same. But you may attribute the woman's mistake to being bad or good luck and in Darrell's situation, you may say he made that mistake because of his inability."
"s12526","eng","The purpose of this study may also be to test thinking skills and how well people recall information they just viewed. "
"s12527","eng","To show the reaction to the English language and phrases."
"s12529","eng","The purpose of this study was to study how language and language comprehension works"
"s12531","eng","The difference between being sure of something and only believing you are sure of it, without knowledge of extraneous variables"
"s12533","eng","to compare students answers"
"s12534","eng","I think the purpose of the study is see what of the opinion of a person in a scenario"
"s12537","eng","To see how people use language and terminology"
"s12539","eng","Reading comprehension"
"s12540","eng","reading comprehension "
"s12541","eng","to understand when people are sure of something and when they are not"
"s12542","eng","To see how different circumstances affect our knowledge"
"s12543","eng","Was trying to figure it out the question were a bit different"
"s12544","eng","To see if the participants understands language."
"s12545","eng","I believe the purpose of this study is to examine how people's subconscious conclusions are affected by the wording used to describe the event. "
"s12547","eng","The study overall is about language, so maybe all the scenarios were about interpreting and to see how much attention or how much we understood from it.
"
"s12550","eng","I feel that the purpose is not simply language, but to assess human bias when it comes to ability. I noticed my initial subconscious response to whether it was luck or ability was dependent on whether the main character in the story was actually right or wrong in their assessment. 

That said, in the first story, I was more confident in attributing his mistake to ability because I feel that it would be easier to distinguish a dog from a squirrel as opposed to say a diamond from a zirconia. "
"s12551","eng","The recall of language or the idea of language and what we associate certain words with certain phrases. "
"s12552","eng","I believe the study has something to do with perception and reading skills. "
"s12553","eng","To see how you think of what is going on."
"s12557","eng","memory study"
"s12559","eng","To learn how we understand and interpret things."
"s12560","eng","The purpose of this study might be to test the participants' attention to the scenario. "
"s12562","eng","To test memory and comprehension."
"s12564","eng","Understanding language and seeing if people can distinguish ability vs luck"
"s12565","eng","To measure comprehension skills."
"s12566","eng","To see if people can determine assumptions"
"s12569","eng","To find out if student believe they are helping real research studies"
"s12571","eng","How well someone can understand what is being said and asked, although it might be framed in an confusing way."
"s12574","eng","To check how much people were paying attention"
"s12576","eng","To investigate how participants' assumptions/ associations can affect their beliefs"
"s12577","eng","attention to detail"
"s12578","eng","To gauge the attention people pay to details in short stories."
"s12579","eng","To see how people interpret language when portrayed in a particular way"
"s12580","eng","I think the purpose is to see how well one reads and comprehends a paragraph to see if one typically uses a set of words over another."
"s12581","eng","It is very different from all the other studies I have done it was pretty easy"
"s12585","eng","To see how participants interpret words "
"s12586","eng","How language works"
"s12587","eng","I believe the purpose for this study is to gather information based on the participants' answer. "
"s12590","eng","To determine how connotations affect language."
"s12594","eng","I think the purpose of the study was to see whether we pay attention to the readings "
"s12595","eng","To understand my abilities towards language comprehension."
"s12596","eng","A perception of thinks we believe if its true or not"
"s12601","eng","to study how certain wording can alter of perception of what happened or what we thought happened"
"s12608","eng","To see how much we feel as though certain situations in life happen to us because of luck or our actual talents."
"s12612","eng","To determine how the language one uses in stories affects the readers perceptions of the character's point of views. "
"s12615","eng","To study language and how people might interpret and describe events."
"s12616","eng","To decipher how blameworthy the participant thinks the characters in the scenarios are"
"s12662","eng","it was new to me"
"s12687","eng","To understand how people percieve luck and objectivity. "
"s12745","eng","to judge perceptions on luck vs ability."
"s12790","eng","To grasp perception of individuals with the unknown realities. "
"s12799","eng","To see how our minds perceive different situations and how we analyze one another."
"s12807","eng","People misperceive things based off of their misperceptions of what they see and know. "
"s12809","eng","I think the purpose of the study was to see if the participant was able to understand the language of the scenarios and make logic. "
"s12810","eng","to further understand how people interpret language differently"
"s12814","eng","Maybe to see how people interpret different situations "
"s12818","eng","to identify how word choices determine if a person was right."
"s12821","eng","Reading comprehension "
"s12826","eng","TEST"
"s12827","eng","TEST"
"s12828","eng","To help make you think before you speak. "
"s12830","eng","TEST"
"s12833","eng","To see how knowledge of a situation impacts the appropriate words used by those describing it in third person?"
"s12843","eng","Attention to detail in readings "
"s12848","eng","to se how far people slid the bar over "
"s12849","eng","To test how small details in similar scenarios affect the language we use to describe them"
"s12850","eng","To judge how a person would like about a certain situation "
"s12853","eng","Looking at the different ways things can be worded "
"s12854","eng","To see how people judge another person based on their actions from what they perceive"
"s12861","eng","To determine how word choice affects clarity of a text"
"s12863","eng","I have next to no idea"
"s12865","eng","To see if people thought someone not knowing something for sure meant that they didnt know at all?"
"s12869","eng","To better understand how we interpret certain aspects of language that don't have one strict right or wrong answer."
"s12873","eng","TEST"
"s12875","eng","to find out comprehensive the readings were"
"s12895","eng","I would assume it would be to gauge the readers ability to comprehend what they are reading"
"s12896","eng","To learn more about how language works."
"s12908","eng","I think the purpose of this study was to see how people responded to the questions. "
"s12909","eng","It could possibly deal with knowing or just thinking that we know things."
"s12920","eng","To test the influence of wording on the level of trust and authenticity of certain situations."
"s12921","eng","I believe it was to help use reasoning and cognitive skills to work together at the same time. "
"s12923","eng","How carefully readers read."
"s12926","eng","to see how well people read passages"
"s12927","eng","to see how people think in certain scenarios, and to see if people actually read the passages."
"s12930","eng","Ideologies and perspectives of different people"
"s12931","eng","Put ourselves in the situation of the characters to determine what they are thinking in certain situations. "
"s12939","eng","I think the purpose of this study was to show that some things can be misconceiving "
"s12940","eng","To see how people responded to the scenario."
"s12941","eng","I think the purpose of this study is to find out how people read language with comprehension. Based on the questions of the three scenarios presented in the study, reading and comprehension was the key. Without understanding the story, one cannot correctly answer the study questions. "
"s12942","eng","It seemed like I was taking a test based on the comprehension of the readings."
"s12949","eng","To judge how well someone can remember specific phrases from a reading."
"s12957","eng","TEST"
